word,meaning,example
Survey,調查,We conducted a survey.
Survive,生存,He survived the crash.
Suspend,暫停；懸掛,The game was suspended due to rain.
Sustain,維持,We cannot sustain this pace.
Symbol,象徵,The dove is a symbol of peace.
Tape,錄音帶；膠帶,He recorded the song on tape.
Target,目標,Hit the target.
Task,任務,Complete the task by noon.
Team,團隊,We work as a team.
Technical,技術的,I have some technical problems.
Technique,技巧,He has good technique.
Technology,科技,Modern technology is amazing.
Temporary,暫時的,This is a temporary job.
Tension,緊張,There was tension in the room.
Terminate,終止,His contract was terminated.
Text,文本,Read the text carefully.
Theme,主題,The theme of the party is the 80s.
Theory,理論,Darwin's theory of evolution.
Thereby,因此,He signed the contract, thereby accepting the terms.
Thesis,論文；論點,He is writing his master's thesis.
Topic,主題,Change the topic.
Trace,追蹤；痕跡,Police traced the call.
Tradition,傳統,It is a family tradition.
Transfer,轉移,He transferred to another school.
Transform,改變,The room was transformed.
Transit,運輸,Goods are in transit.
Transmit,傳送,The disease is transmitted by mosquitoes.
Transport,運輸,Trucks transport goods.
Trend,趨勢,There is a trend towards healthy eating.
Trigger,引發；板機,Smoke triggered the alarm.
Ultimate,最終的,His ultimate goal is to travel.
Undergo,經歷,He underwent surgery.
Underlie,構成...的基礎,Hard work underlies his success.
Undertake,承擔；著手,He undertook the responsibility.
Uniform,制服；一致的,Soldiers wear uniforms.
Unify,統一,The country was unified.
Unique,獨特的,Everyone is unique.
Utilize,利用,We must utilize our resources.
Valid,有效的,Is your passport valid?
Vary,變化,Prices vary from store to store.
Vehicle,車輛,Do not park your vehicle here.
Version,版本,This is the latest version.
Via,經由,We flew to London via Paris.
Violate,違反,Do not violate the law.
Virtual,虛擬的,We had a virtual meeting.
Visible,可見的,The stars are visible tonight.
Vision,視力；願景,He has perfect vision.
Visual,視覺的,Visual aids help learning.
Volume,音量；體積；卷,Turn up the volume.
Voluntary,自願的,Attendance is voluntary.
Welfare,福利,He is concerned about animal welfare.
Whereas,然而,He is rich, whereas I am poor.
Whereby,憑此,They made a deal whereby he gets half.
Widespread,廣泛的,Flu is widespread this winter.
Aberration,異常；反常現象,The sudden drop in temperature was an aberration for this time of year.
Acquiesce,默認；勉強同意,She acquiesced to her boss's demands despite her objections.
Acrimonious,尖刻的；充滿火藥味的,The debate became acrimonious as both sides shouted at each other.
Admonish,訓誡；警告,The teacher admonished the student for being late again.
Aesthetic,美學的；審美的,The building has a unique aesthetic appeal.
Alacrity,樂意；敏捷,He accepted the offer with alacrity.
Alleviate,減輕；緩和,This medicine will help alleviate the pain.
Ambivalent,矛盾的；猶豫不決的,I felt ambivalent about moving to a new city.
Ameliorate,改善；改良,Foreign aid is needed to ameliorate the effects of the drought.
Anachronism,時代錯誤；不合時宜的人事物,The sword in the modern movie was an anachronism.
Anomaly,異常；不規則,There is an anomaly in the data that we cannot explain.
Antipathy,反感；厭惡,He felt a strong antipathy towards his rival.
Apathetic,冷淡的；無動於衷的,Voters are becoming increasingly apathetic.
Appease,平息；安撫,They tried to appease the angry crowd.
Arcane,深奧的；神秘的,He has knowledge of arcane legal procedures.
Arduous,艱鉅的；費力的,It was an arduous climb up the mountain.
Articulate,清晰表達的；口齒伶俐的,She is an articulate speaker.
Assuage,緩和；減輕,He tried to assuage her guilt.
Audacious,大膽的；無畏的,It was an audacious plan to steal the diamond.
Austere,嚴厲的；簡樸的,The monks lived an austere life.
Banal,平庸的；陳腐的,The movie's plot was banal and predictable.
Belligerent,好戰的；挑釁的,He was drunk and belligerent.
Benevolent,仁慈的,A benevolent donor gave a million dollars to the charity.
Bolster,支持；加強,We need to bolster our defenses.
Boisterous,喧鬧的；精力旺盛的,The crowd was boisterous after the win.
Breach,違背；缺口,This is a clear breach of contract.
Cacophony,雜音；刺耳的聲音,A cacophony of car horns filled the street.
Candid,率直的；坦白的,Please be candid with me.
Capricious,善變的；反覆無常的,The weather here is capricious.
Castigate,嚴厲譴責,The director castigated the actors for being late.
Catalyst,催化劑；促進因素,The protest was a catalyst for change.
Caustic,腐蝕性的；刻薄的,She made a caustic remark about his clothes.
Censure,嚴厲斥責,The senator was censured for his misconduct.
Chronicle,編年史；記錄,The book chronicles the history of the war.
Circumspect,謹慎的,He is circumspect about sharing his views.
Clandestine,秘密的；暗中的,They had a clandestine meeting in the park.
Coalesce,聯合；合併,The different groups coalesced into a single party.
Coerce,強迫；威脅,He was coerced into signing the confession.
Cogent,令人信服的,She presented a cogent argument.
Complacent,自滿的,We cannot afford to be complacent about safety.
Concede,承認；讓步,He conceded that he had made a mistake.
Concise,簡潔的,Keep your summary concise.
Concur,同意,I concur with your assessment.
Condone,寬恕；縱容,I cannot condone violence of any kind.
Connoisseur,鑑賞家；行家,He is a connoisseur of fine wine.
Consensus,共識,We need to reach a consensus.
Contentious,有爭議的,Abortion is a highly contentious issue.
Credible,可信的,We need a credible witness.
Culpable,該受譴責的；有罪的,He is culpable for the accident.
Cultivate,培養；耕作,She tried to cultivate a friendship with him.
Debilitate,使衰弱,The disease debilitated him.
Debunk,揭穿；拆穿,The article debunks the myth that sugar causes hyperactivity.
Decorum,禮貌；端莊,He behaved with decorum at the funeral.
Deference,尊崇；順從,He treated the elders with deference.
Delineate,描繪；勾勒,The report delineates the steps to be taken.
Demur,表示異議；反對,She suggested a plan, but he demurred.
Deride,嘲笑；嘲弄,They derided his efforts to sing.
Desolate,荒涼的；孤獨的,The landscape was desolate.
Deterrent,威懾力量；遏制物,Nuclear weapons are a deterrent to war.
Diatribe,抨擊；謾罵,He launched a bitter diatribe against the government.
Didactic,說教的；教誨的,The novel is too didactic for my taste.
Diffident,缺乏自信的；羞怯的,He was diffident about speaking in public.
Digress,離題,Let me digress for a moment.
Dilemma,進退兩難的困境,I am facing a difficult dilemma.
Diligent,勤奮的,He is a diligent student.
Discern,辨別；看出,It is difficult to discern the truth.
Discrepancy,差異；不一致,There is a discrepancy between the two accounts.
Disdain,輕視；鄙視,He looked at the beggar with disdain.
Disingenuous,不真誠的；虛偽的,It was disingenuous of him to claim he didn't know.
Disparate,迥然不同的,The group is made up of disparate individuals.
Disseminate,散布；傳播,The internet helps disseminate information.
Dissent,異議,There was some dissent within the party.
Dogmatic,教條的；武斷的,He is dogmatic in his beliefs.
Dubious,可疑的；半信半疑的,I am dubious about his claims.
Ebullient,熱情洋溢的,She was ebullient after passing the exam.
Eclectic,折衷的；兼容並蓄的,He has an eclectic taste in music.
Efficacy,功效,The efficacy of the drug is proven.
Egregious,極壞的；令人震驚的,It was an egregious error.
Eloquent,雄辯的；有說服力的,He gave an eloquent speech.
Elucidate,闡明；說明,Please elucidate your point.
Elusive,難以捉摸的,Success remained elusive.
Emulate,模仿；效法,He tried to emulate his father.
Enervate,使衰弱,The hot weather enervated us.
Enigma,謎,His character is an enigma.
Ephemeral,短暫的,Fashion is ephemeral.
Equivocal,模稜兩可的,His answer was equivocal.
Erudite,博學的,He is an erudite scholar.
Esoteric,深奧難懂的,This subject is too esoteric for me.
Eulogy,悼詞；頌詞,He delivered a moving eulogy at the funeral.
Exacerbate,惡化；加劇,The new law exacerbated the problem.
Exculpate,開脫；證明無罪,The evidence exculpated him.
Exemplary,模範的,His behavior was exemplary.
Exhaustive,詳盡的,They conducted an exhaustive search.
Exonerate,免除責任；證明無罪,The investigation exonerated the police officer.
Expedient,權宜的；方便的,It was expedient to ignore the rules.
Extol,讚揚,He extolled the virtues of hard work.
Extraneous,無關的；外來的,Remove all extraneous details from the report.
Fabricate,捏造；製造,He fabricated a story to explain his absence.
Fastidious,挑剔的；一絲不苟的,He is fastidious about his appearance.
Fathom,理解；測量深度的單位,I cannot fathom why he did that.
Garner,獲得；收集,He garnered enough votes to win the election.
Garrulous,嘮叨的；多嘴的,The garrulous old man told us his life story.
Gregarious,社交的；群居的,She is a gregarious person who loves parties.
Hackneyed,陳腐的；老生常談的,The plot of the movie was hackneyed.
Haphazard,隨意的；無計畫的,The books were piled in a haphazard manner.
Harangue,慷慨激昂地演講；斥責,He harangued the crowd for hours.
Haughty,傲慢的,She gave him a haughty look.
Hedonist,享樂主義者,He lived the life of a hedonist.
Hegemony,霸權；領導權,The country lost its hegemony over the region.
Heresy,異端邪說,His views were considered heresy by the church.
Homage,敬意；致敬,The movie pays homage to the classics.
Hubris,傲慢；自大,His hubris led to his downfall.
Hyperbole,夸飾法,He used hyperbole to make his point.
Hypocrisy,偽善,I cannot stand his hypocrisy.
Iconoclast,反傳統者；偶像破壞者,As an iconoclast, he attacked established beliefs.
Idiosyncrasy,特質；怪癖,One of his idiosyncrasies is talking to himself.
Imminent,即將發生的,They were in imminent danger.
Immutable,不可變的,The laws of physics are immutable.
Impartial,公正的,A judge must be impartial.
Impassive,冷漠的；無動於衷的,He kept an impassive face.
Impeccable,無懈可擊的；完美的,Her taste in fashion is impeccable.
Impediment,障礙,Poverty is an impediment to education.
Impetuous,衝動的,He made an impetuous decision.
Implacable,難以安撫的；不共戴天的,He was an implacable enemy.
Impromptu,即興的,He gave an impromptu speech.
Impudent,放肆的；無禮的,The student was impudent to the teacher.
Inadvertent,不注意的；非故意的,The mistake was inadvertent.
Inane,空洞的；愚蠢的,He made some inane remarks.
Incessant,不停的,The incessant noise drove me crazy.
Incisive,銳利的；透徹的,She offered incisive criticism.
Incongruous,不協調的,The modern furniture looked incongruous in the old house.
Incorrigible,無可救藥的,He is an incorrigible liar.
Indifferent,漠不關心的,He was indifferent to their suffering.
Indigenous,本土的,The kangaroo is indigenous to Australia.
Indigent,貧困的,The clinic serves indigent patients.
Indolent,懶惰的,He is an indolent worker.
Inept,無能的；笨拙的,He is socially inept.
Inert,惰性的；遲鈍的,The gas is chemically inert.
Inexorable,不可阻擋的；無情的,The inexorable march of time.
Infamous,聲名狼藉的,He is an infamous criminal.
Ingenuous,天真的；坦率的,She gave an ingenuous smile.
Inimical,有害的；敵對的,Smoking is inimical to health.
Innate,與生俱來的,He has an innate talent for music.
Innocuous,無害的,The remark seemed innocuous.
Inscrutable,難以捉摸的；高深莫測的,His face was inscrutable.
Insipid,乏味的；平淡的,The soup was insipid.
Insolent,傲慢無禮的,The child was insolent to his parents.
Insular,島嶼的；心胸狹窄的,They have insular attitudes.
Intangible,無形的；觸摸不到的,Goodwill is an intangible asset.
Intermittent,間歇的,The rain was intermittent.
Intractable,難駕馭的；棘手的,The problem proved intractable.
Intransigent,不妥協的,Both sides remained intransigent.
Intrepid,無畏的,The intrepid explorer climbed the mountain.
Intricate,錯綜複雜的,The pattern is very intricate.
Intuition,直覺,I had an intuition that something was wrong.
Inundate,淹沒；使應接不暇,We were inundated with complaints.
Irascible,易怒的,He is an irascible old man.
Irreverent,不敬的,He has an irreverent sense of humor.
Itinerant,巡迴的；流動的,An itinerant worker.
Jaded,厭倦的；疲憊的,He became jaded with city life.
Jeopardy,危險,The project is in jeopardy.
Jocular,愛開玩笑的,He was in a jocular mood.
Jubilant,歡欣鼓舞的,The fans were jubilant after the victory.
Judicious,明智的,He made a judicious choice.
Juxtapose,並列,The artist juxtaposed light and dark colors.
Kinetic,動態的,Kinetic energy.
Laconic,簡潔的；寡言的,His reply was laconic.
Lament,哀悼；痛惜,She lamented the loss of her friend.
Languid,倦怠的；無精打采的,She felt languid after the illness.
Latent,潛伏的,He has a latent talent for painting.
Laud,讚美,He was lauded for his courage.
Lavish,奢華的；揮霍的,They held a lavish party.
Lethargic,昏睡的；無生氣的,I felt lethargic all day.
Levity,輕浮；輕率,This is no time for levity.
Loathe,厭惡,I loathe spinach.
Loquacious,多話的,She is very loquacious.
Lucid,清晰的；神志清醒的,His explanation was lucid.
Lucrative,有利可圖的,It is a lucrative business.
Luminous,發光的,The stars were luminous.
Magnanimous,寬宏大量的,He was magnanimous in victory.
Maladroit,笨拙的,His handling of the situation was maladroit.
Malevolent,惡意的,She gave him a malevolent look.
Malleable,可塑的；易受影響的,Silver is a malleable metal.
Maverick,特立獨行的人,He is a political maverick.
Meager,貧乏的；不足的,They lived on a meager income.
Meander,蜿蜒；漫步,The river meanders through the valley.
Melancholy,憂鬱的,He fell into a deep melancholy.
Mellifluous,聲音甜美的；流暢的,She has a mellifluous voice.
Mendacious,虛假的；說謊的,The report was mendacious.
Mercurial,善變的,She has a mercurial temperament.
Meritorious,值得表揚的,He received an award for meritorious service.
Mitigate,緩和；減輕,We must take steps to mitigate the risk.
Modicum,少量,He doesn't have a modicum of common sense.
Mollify,安撫；平息,He tried to mollify the angry customer.
Momentous,重大的,It was a momentous decision.
Monotony,單調,The monotony of the job bored him.
Morbid,病態的,He has a morbid interest in death.
Morose,陰鬱的,He was silent and morose.
Mundane,世俗的；平凡的,She performs mundane tasks.
Munificent,慷慨的,A munificent gift.
Myriad,無數的,There are myriad reasons for the problem.
Nadir,最低點,His career reached its nadir.
Narcissism,自戀,His narcissism is annoying.
Nebulous,模糊的,His plans are still nebulous.
Nefarious,邪惡的,He had a nefarious scheme.
Negligible,微不足道的,The cost was negligible.
Nomad,遊牧民,The nomads travel across the desert.
Nonchalant,漠不關心的；若無其事的,He was nonchalant about the danger.
Nostalgia,鄉愁；懷舊,He felt a wave of nostalgia.
Notorious,惡名昭彰的,He is a notorious gambler.
Novel,新奇的,It was a novel idea.
Noxious,有害的；有毒的,Noxious fumes filled the air.
Nuance,細微差別,He understood the nuances of the language.
Nullify,使無效,The law was nullified.
Obdurate,頑固的,He remained obdurate in his refusal.
Obfuscate,使困惑；混淆,He tried to obfuscate the issue.
Oblivious,沒注意到的,He was oblivious to the noise.
Obscure,模糊的；晦澀的,The meaning is obscure.
Obsequious,諂媚的,He is obsequious to his boss.
Obsolete,過時的,Typewriters are obsolete.
Obstinate,固執的,He is an obstinate old man.
Obviate,排除；消除,This new evidence obviates the need for a trial.
Odious,可憎的,It was an odious crime.
Ominous,不祥的,Dark clouds looked ominous.
Opaque,不透明的；難懂的,The glass is opaque.
Opulent,富裕的；豪華的,They live in an opulent mansion.
Ostentatious,鋪張的；炫耀的,He wears ostentatious jewelry.
Ostracize,排擠；放逐,She was ostracized by her colleagues.
Painstaking,辛苦的；極小心的,It was a painstaking process.
Palatable,美味的；可接受的,The food was not palatable.
Palliate,緩和；掩飾,They tried to palliate the hardship.
Palpable,可感知的；明顯的,The tension was palpable.
Panacea,萬靈丹,Education is not a panacea for all ills.
Paradox,矛盾,It is a paradox that he is rich but unhappy.
Paragon,模範,He is a paragon of virtue.
Pariah,被社會遺棄者,He became a pariah in the village.
Parsimonious,吝嗇的,He is parsimonious with his money.
Partisan,黨派的；偏袒的,It was a partisan decision.
Patent,明顯的；專利,It was a patent lie.
Paternal,父親的,He offered paternal advice.
Pathology,病理學,The pathology of the disease is complex.

Abstain,戒除；棄權,He abstained from alcohol for a year.
Abundance,豐富；充足,There is an abundance of food.
Accelerate,加速,The car accelerated to overtake the bus.
Accessible,可接近的；易懂的,Information should be accessible to everyone.
Claim,聲稱；索賠,He claims to own the land.
Acclaim,稱讚；喝采,The movie received critical acclaim.
Accompany,陪伴；伴奏,Children must be accompanied by an adult.
Accord,一致；協議,We are in accord on this issue.
Accountable,應負責任的,Politicians should be accountable to the public.
Accusation,指控,He denied the accusation of theft.
Accustom,使習慣,It takes time to accustom yourself to the heat.
Achievement,成就,Winning the prize was a great achievement.
Acid,酸；酸性的,Lemon juice contains acid.
Acoustic,聽覺的；原聲的,He plays an acoustic guitar.
Acquaint,使熟悉,Please acquaint yourself with the rules.
Acute,敏銳的；急性的,He has an acute sense of hearing.
Addict,成癮者,He is a drug addict.
Address,地址；演說；處理,We need to address the problem immediately.
Adhere,黏附；遵守,Glue will retain its ability to adhere.
Adjacent,鄰近的,The parking lot is adjacent to the building.
Administer,管理；執行,The teacher administers the test.
Adolescent,青少年,Adolescent behavior can be unpredictable.
Adoption,收養；採用,The adoption of new technology is slow.
Adverse,不利的；負面的,The drug has adverse side effects.
Advisory,顧問的；諮詢的,He acts in an advisory capacity.
Advocacy,擁護；提倡,Her advocacy for animal rights is well known.
Affection,喜愛；鍾愛,She has deep affection for her parents.
Affiliate,使隸屬；分支機構,The hospital is affiliated with the university.
Affirm,確認；證實,He affirmed his loyalty to the country.
Afflict,折磨；使痛苦,He is afflicted with arthritis.
Affluent,富裕的,They live in an affluent neighborhood.
Agenda,議程,What is on the agenda for today?
Aggravate,加重；激怒,Stress can aggravate the condition.
Aggregate,總計；集合,The aggregate score was 10-5.
Agitation,激動；煽動,He was in a state of agitation.
Agony,極度痛苦,He was in agony after breaking his leg.
Aisle,走道,Would you like an aisle seat?
Alienate,使疏遠,His behavior alienated his friends.
Allegation,指控（未經證實）,He denied the allegations against him.
Alleged,聲稱的；涉嫌的,The alleged killer was arrested.
Alliance,聯盟,The two countries formed an alliance.
Allusion,暗指；典故,The poem contains an allusion to Greek mythology.
Ally,盟友,Unlike enemies, an ally supports you.
Altruism,利他主義,He is known for his altruism.
Amateur,業餘的,He is an amateur photographer.
Ambassador,大使,He is the US ambassador to France.
Amend,修改；修訂,The constitution was amended.
Ample,充足的,There is ample room for everyone.
Analogy,類比,He drew an analogy between the brain and a computer.
Anchor,錨；主播,The ship dropped anchor.
Anecdote,軼事；趣聞,He told a funny anecdote about his boss.
Anguish,極度痛苦,She screamed in anguish.
Animus,敵意,He holds no animus toward his critics.
Annex,併吞；附加,The library is an annex to the school.
Annihilate,殲滅,The army was annihilated.
Annotate,註解,Please annotate the text.
Announce,宣布,They announced their engagement.
Anonymous,匿名的,The donor wishes to remain anonymous.
Antagonism,對抗；敵意,There is antagonism between the two groups.
Antedate,早於,This event antedates the war.
Anthology,選集,An anthology of poems.
Antibiotic,抗生素,The doctor prescribed antibiotics.
Anticipation,預期,We waited in anticipation.
Antique,古董,This chair is a valuable antique.
Antiseptic,防腐的；消毒劑,Put some antiseptic on the cut.
Anxiety,焦慮,She suffers from anxiety.
Apathy,冷漠,Voter apathy is a problem.
Aperture,孔；光圈,The camera has a small aperture.
Apex,頂點,He reached the apex of his career.
Aphorism,格言,He quoted an old aphorism.
Apology,道歉,He owes me an apology.
Apparatus,儀器；機構,The breathing apparatus saved his life.
Appeal,吸引力；上訴,The idea has no appeal to me.
Appendix,附錄；闌尾,See the appendix for more details.
Appetite,食慾,I have a good appetite.
Applaud,鼓掌,The audience applauded loudly.
Applicable,適用的,This rule is not applicable to you.
Applicant,申請人,There were many applicants for the job.
Appoint,任命,He was appointed as chairman.
Appraise,評估；評價,They appraised the house at $200,000.
Apprehend,逮捕；理解,The thief was apprehended.
Apprentice,學徒,He is an apprentice carpenter.
Approximation,近似值,This is only an approximation.
Aptitude,天資；才能,She has an aptitude for math.
Arable,可耕種的,Arable land is scarce here.
Arch,拱門,The bridge has three arches.
Architect,建築師,He is a famous architect.
Archive,檔案館；存檔,We must archive these documents.
Ardent,熱情的,He is an ardent supporter of the team.
Arena,競技場,Politics is a tough arena.
Argue,爭論,Don't argue with me.
Arid,乾燥的,The desert is an arid region.
Aristocracy,貴族階級,He was born into the aristocracy.
Arithmetic,算術,He is good at arithmetic.
Armament,軍備,The country increased its armaments.
Aroma,香氣,The aroma of coffee filled the room.
Arouse,引起；喚起,His behavior aroused suspicion.
Array,排列；一系列,There was a vast array of food.
Arrogant,傲慢的,He is arrogant and rude.
Article,文章；物品,Read this article about health.
Articulate,清晰表達,He cannot articulate his feelings.
Artifact,人造物品（尤指文物）,The museum has many ancient artifacts.
Artificial,人造的,This flower is artificial.
Artistic,藝術的,She has artistic talent.
Ascend,上升；攀登,The plane ascended into the clouds.
Ascertain,查明；確定,We need to ascertain the cause of the fire.
Ascribe,歸因於,He ascribed his success to luck.
Ashamed,羞愧的,I am ashamed of my behavior.
Aspiration,抱負；渴望,He has aspirations to be a writer.
Assail,攻擊,He was assailed by doubts.
Assassinate,暗殺,The president was assassinated.
Assault,襲擊,He was charged with assault.
Assemble,集合；組裝,We assembled the furniture.
Assert,斷言；主張,He asserted his innocence.
Asset,資產；優點,Health is your greatest asset.
Assiduous,勤勉的,He is an assiduous student.
Assimilate,同化；吸收,Immigrants often assimilate into the culture.
Associate,聯想；交往,I associate summer with ice cream.
Assorted,各式各樣的,A box of assorted chocolates.
Assumption,假設,Your assumption is wrong.
Astonish,使驚訝,The news astonished everyone.
Astute,精明的,He is an astute businessman.
Asylum,庇護,They sought political asylum.
Atlas,地圖集,Look at the atlas to find the city.
Atmosphere,氣氛；大氣,The atmosphere was tense.
Atom,原子,Atoms are the building blocks of matter.
Atone,贖罪,He tried to atone for his sins.
Atrocity,暴行,War crimes are atrocities.
Atrophy,萎縮,Muscles atrophy without use.
Attain,獲得；達到,She attained her goal.
Attendance,出席,Attendance is mandatory.
Attentive,專心的,The students were attentive.
Attest,證明,I can attest to his honesty.
Attic,閣樓,We store old boxes in the attic.
Attire,服裝,Formal attire is required.
Attorney,律師,You need to hire an attorney.
Attribute,屬性；歸因於,Patience is a good attribute.
Auction,拍賣,The house was sold at auction.
Audacious,大膽的,It was an audacious plan.
Audible,聽得見的,His voice was barely audible.
Audience,觀眾,The audience clapped.
Audit,審計；查帳,The company faces a tax audit.
Audition,試鏡,She has an audition for a play.
Augment,增加；擴大,He works a second job to augment his income.
Auspicious,吉利的,It was an auspicious beginning.
Authentic,真實的,This is an authentic painting.
Authoritarian,獨裁的,He is an authoritarian leader.
Authority,權威,I have the authority to sign this.
Authorize,授權,I authorized the payment.
